MCQ,Choices,Correct
Who coined the term 'machine learning'?,a: Arthur Samuel | b: Donald Hebb | c: Walter Pitts | d: Warren McCulloch,a
What was the purpose of the 'learning machine' developed by Raytheon Company in the early 1960s?,a: To analyze sonar signals | b: To classify data | c: To make predictions for future outcomes | d: To recognize patterns,a
What did Alan Turing propose in his paper 'Computing Machinery and Intelligence'?,a: Can machines think? | b: Can machines do what we can do? | c: Can machines learn from experience? | d: Can machines understand human language?,b
What is the main goal of modern-day machine learning?,a: To classify data | b: To make predictions for future outcomes | c: To study human cognitive processes | d: To understand human language,b
What is the main difference between machine learning and data mining?,a: Data mining focuses on the discovery of unknown properties in the data | b: Machine learning focuses on prediction | c: Data mining focuses on the analysis of known properties | d: Machine learning focuses on the discovery of unknown properties,a
